[
  {
    "event_id": "t2-001",
    "timestamp": "2026-01-02T14:00:00+05:30",
    "event_type": "LOGIN",
    "account_id": "acct-demo-t2-001",
    "session_id": "session-t2-001",
    "device_id": "device-t2-001",
    "authentication": {
      "method": "PASSWORD",
      "status": "SUCCESS",
      "attempt_count": 1
    },
    "context": {
      "ip_context": "new",
      "geo_context": "unusual",
      "hour_context": "normal"
    }
  },
  {
    "event_id": "t2-002",
    "timestamp": "2026-01-02T14:04:00+05:30",
    "event_type": "TRANSFER",
    "account_id": "acct-demo-t2-001",
    "session_id": "session-t2-001",
    "device_id": "device-t2-001",
    "transaction": {
      "amount": 30000,
      "currency": "INR",
      "direction": "OUTGOING",
      "status": "SUCCESS"
    },
    "context": {
      "ip_context": "new",
      "geo_context": "unusual",
      "hour_context": "normal"
    }
  }
]